{
  "$schema": "http://json-schema.org/draft-07/schema#",
  "title": "task-context",
  "type": "object",
  "required": [
    "schemaVersion",
    "task",
    "entities",
    "constraints",
    "relationships",
    "continuity",
    "outputRequirements"
  ],
  "properties": {
    "schemaVersion": {
      "const": "1.0"
    },
    "task": {
      "type": "object",
      "required": [
        "id",
        "prompt",
        "entityIds",
        "tags",
        "must",
        "mustNot",
        "outputRequirements"
      ],
      "properties": {
        "id": {
          "type": "string"
        },
        "prompt": {
          "type": "string"
        },
        "entityIds": {
          "type": "array",
          "items": {
            "type": "string"
          }
        },
        "tags": {
          "type": "array",
          "items": {
            "type": "string"
          }
        },
        "must": {
          "type": "array",
          "items": {
            "type": "string"
          }
        },
        "mustNot": {
          "type": "array",
          "items": {
            "type": "string"
          }
        },
        "outputRequirements": {
          "type": "object"
        }
      },
      "additionalProperties": false
    },
    "entities": {
      "type": "array",
      "items": {
        "type": "object",
        "required": [
          "@id",
          "@type",
          "name",
          "attributes",
          "relationships",
          "rules",
          "provenance"
        ],
        "properties": {
          "@id": {
            "type": "string",
            "minLength": 1
          },
          "@type": {
            "type": "string"
          },
          "name": {
            "type": "string",
            "minLength": 1
          },
          "attributes": {
            "type": "object"
          },
          "relationships": {
            "type": "array",
            "items": {
              "type": "string"
            }
          },
          "rules": {
            "type": "object",
            "required": [
              "mustPreserve",
              "mayVary",
              "avoid"
            ],
            "properties": {
              "mustPreserve": {
                "type": "array",
                "items": {
                  "type": "string"
                }
              },
              "mayVary": {
                "type": "array",
                "items": {
                  "type": "string"
                }
              },
              "avoid": {
                "type": "array",
                "items": {
                  "type": "string"
                }
              }
            },
            "additionalProperties": false
          },
          "provenance": {
            "type": "array",
            "minItems": 1,
            "items": {
              "type": "object",
              "required": [
                "source",
                "type",
                "confidence"
              ],
              "properties": {
                "source": {
                  "type": "string",
                  "minLength": 1
                },
                "type": {
                  "enum": [
                    "user-canon",
                    "inferred",
                    "generated",
                    "external",
                    "uncertain"
                  ]
                },
                "confidence": {
                  "type": "number",
                  "minimum": 0,
                  "maximum": 1
                },
                "locator": {
                  "type": "string"
                }
              },
              "additionalProperties": false
            }
          }
        },
        "additionalProperties": false
      }
    },
    "constraints": {
      "type": "object",
      "required": [
        "must",
        "mustNot",
        "may"
      ],
      "properties": {
        "must": {
          "type": "array",
          "items": {
            "type": "string"
          }
        },
        "mustNot": {
          "type": "array",
          "items": {
            "type": "string"
          }
        },
        "may": {
          "type": "array",
          "items": {
            "type": "string"
          }
        }
      },
      "additionalProperties": false
    },
    "relationships": {
      "type": "array",
      "items": {
        "type": "object",
        "required": [
          "from",
          "to"
        ],
        "properties": {
          "from": {
            "type": "string"
          },
          "to": {
            "type": "string"
          }
        },
        "additionalProperties": false
      }
    },
    "continuity": {
      "type": "array",
      "items": {
        "type": "object",
        "required": [
          "entityId",
          "value",
          "provenance"
        ],
        "properties": {
          "entityId": {
            "type": "string"
          },
          "value": {
            "type": "object"
          },
          "provenance": {
            "type": "array",
            "minItems": 1,
            "items": {
              "type": "object",
              "required": [
                "source",
                "type",
                "confidence"
              ],
              "properties": {
                "source": {
                  "type": "string",
                  "minLength": 1
                },
                "type": {
                  "enum": [
                    "user-canon",
                    "inferred",
                    "generated",
                    "external",
                    "uncertain"
                  ]
                },
                "confidence": {
                  "type": "number",
                  "minimum": 0,
                  "maximum": 1
                },
                "locator": {
                  "type": "string"
                }
              },
              "additionalProperties": false
            }
          }
        },
        "additionalProperties": false
      }
    },
    "outputRequirements": {
      "type": "object"
    }
  },
  "additionalProperties": false
}
